{
  "abba_blocks": 10,
  "cells": [
    {
      "abba_blocks": 10,
      "fresh_processes": true,
      "kind": "COLD_START",
      "measured_run_labels": [
        "f16-split-seed-h2d-cold-b0-a1",
        "f16-split-seed-h2d-cold-b0-a2",
        "f16-split-seed-h2d-cold-b0-b1",
        "f16-split-seed-h2d-cold-b0-b2",
        "f16-split-seed-h2d-cold-b1-a1",
        "f16-split-seed-h2d-cold-b1-a2",
        "f16-split-seed-h2d-cold-b1-b1",
        "f16-split-seed-h2d-cold-b1-b2",
        "f16-split-seed-h2d-cold-b2-a1",
        "f16-split-seed-h2d-cold-b2-a2",
        "f16-split-seed-h2d-cold-b2-b1",
        "f16-split-seed-h2d-cold-b2-b2",
        "f16-split-seed-h2d-cold-b3-a1",
        "f16-split-seed-h2d-cold-b3-a2",
        "f16-split-seed-h2d-cold-b3-b1",
        "f16-split-seed-h2d-cold-b3-b2",
        "f16-split-seed-h2d-cold-b4-a1",
        "f16-split-seed-h2d-cold-b4-a2",
        "f16-split-seed-h2d-cold-b4-b1",
        "f16-split-seed-h2d-cold-b4-b2",
        "f16-split-seed-h2d-cold-b5-a1",
        "f16-split-seed-h2d-cold-b5-a2",
        "f16-split-seed-h2d-cold-b5-b1",
        "f16-split-seed-h2d-cold-b5-b2",
        "f16-split-seed-h2d-cold-b6-a1",
        "f16-split-seed-h2d-cold-b6-a2",
        "f16-split-seed-h2d-cold-b6-b1",
        "f16-split-seed-h2d-cold-b6-b2",
        "f16-split-seed-h2d-cold-b7-a1",
        "f16-split-seed-h2d-cold-b7-a2",
        "f16-split-seed-h2d-cold-b7-b1",
        "f16-split-seed-h2d-cold-b7-b2",
        "f16-split-seed-h2d-cold-b8-a1",
        "f16-split-seed-h2d-cold-b8-a2",
        "f16-split-seed-h2d-cold-b8-b1",
        "f16-split-seed-h2d-cold-b8-b2",
        "f16-split-seed-h2d-cold-b9-a1",
        "f16-split-seed-h2d-cold-b9-a2",
        "f16-split-seed-h2d-cold-b9-b1",
        "f16-split-seed-h2d-cold-b9-b2"
      ],
      "metrics": {
        "cold_process_to_first_token_us": {
          "absolute_candidate_minus_baseline": {
            "ci95_high": 2327807.058081724,
            "ci95_low": 2315121.1252182764,
            "mean": 2321464.0916500003,
            "n": 10,
            "samples": [
              2325670.592,
              2327648.6055,
              2314065.1470000003,
              2322925.1109999996,
              2326835.4005,
              2313513.1865,
              2312958.66,
              2332194.1835000003,
              2331802.9965,
              2307027.0340000005
            ],
            "student_t_critical": 2.262
          },
          "baseline": {
            "count": 10,
            "max": 396204.275,
            "mean": 390249.70875,
            "min": 386563.3995,
            "p50": 389046.663,
            "p95": 396204.275,
            "p99": 396204.275
          },
          "candidate": {
            "count": 10,
            "max": 2721819.4035,
            "mean": 2711713.8004,
            "min": 2703231.3090000004,
            "p50": 2711847.03,
            "p95": 2721819.4035,
            "p99": 2721819.4035
          },
          "relative_improvement": {
            "ci95_high": -5.901943075148564,
            "ci95_low": -5.996288085725993,
            "mean": -5.949115580437279,
            "n": 10,
            "samples": [
              -6.0011066075234485,
              -6.000904830979296,
              -5.925895667415781,
              -5.972728708561164,
              -6.019285332004123,
              -5.876850900116635,
              -5.892191165692883,
              -5.985737225891077,
              -5.993633202040856,
              -5.822822164147523
            ],
            "student_t_critical": 2.262
          }
        },
        "decode_mean_us": {
          "absolute_candidate_minus_baseline": {
            "ci95_high": 1572.2434323058421,
            "ci95_low": 1231.7165676941584,
            "mean": 1401.9800000000002,
            "n": 10,
            "samples": [
              1589.6999999999998,
              1178.0999999999985,
              1541.9333333333325,
              1564.6000000000004,
              1190.9333333333343,
              1359.4333333333343,
              1657.6333333333323,
              953.1666666666679,
              1648.8666666666686,
              1335.4333333333334
            ],
            "student_t_critical": 2.262
          },
          "baseline": {
            "count": 10,
            "max": 8454.8,
            "mean": 8141.046666666666,
            "min": 8007.166666666667,
            "p50": 8039.566666666667,
            "p95": 8454.8,
            "p99": 8454.8
          },
          "candidate": {
            "count": 10,
            "max": 9686.400000000001,
            "mean": 9543.026666666667,
            "min": 9288.7,
            "p50": 9577.733333333334,
            "p95": 9686.400000000001,
            "p99": 9686.400000000001
          },
          "relative_improvement": {
            "ci95_high": -0.1501069412731939,
            "ci95_low": -0.19521245408185067,
            "mean": -0.1726596976775223,
            "n": 10,
            "samples": [
              -0.19773453793114884,
              -0.1416286310795159,
              -0.1897219260109916,
              -0.1952544572659884,
              -0.1470693565715651,
              -0.16404936404373266,
              -0.20647633757670864,
              -0.11273674914447035,
              -0.2051458573525877,
              -0.16677975979851384
            ],
            "student_t_critical": 2.262
          }
        },
        "decode_p95_us": {
          "absolute_candidate_minus_baseline": {
            "ci95_high": 1730.2319482311257,
            "ci95_low": 1448.0680517688745,
            "mean": 1589.15,
            "n": 10,
            "samples": [
              1811.0,
              1394.0,
              1582.0,
              1621.5,
              1663.5,
              1435.0,
              1827.0,
              1192.0,
              1700.0,
              1665.5
            ],
            "student_t_critical": 2.262
          },
          "baseline": {
            "count": 10,
            "max": 11082.0,
            "mean": 10710.1,
            "min": 10544.0,
            "p50": 10659.0,
            "p95": 11082.0,
            "p99": 11082.0
          },
          "candidate": {
            "count": 10,
            "max": 12472.0,
            "mean": 12299.25,
            "min": 12170.5,
            "p50": 12280.5,
            "p95": 12472.0,
            "p99": 12472.0
          },
          "relative_improvement": {
            "ci95_high": -0.13423908695943976,
            "ci95_low": -0.1630084192803865,
            "mean": -0.14862375311991313,
            "n": 10,
            "samples": [
              -0.16987149423131037,
              -0.1280485004363202,
              -0.14846096096096095,
              -0.15212496481846327,
              -0.1565941824343406,
              -0.13366866936798472,
              -0.17268431001890358,
              -0.10756181194730192,
              -0.15926550496533634,
              -0.1579571320182094
            ],
            "student_t_critical": 2.262
          }
        },
        "decode_throughput_tps": {
          "absolute_candidate_minus_baseline": {
            "ci95_high": -15.935359178883346,
            "ci95_low": -20.276352006526928,
            "mean": -18.105855592705137,
            "n": 10,
            "samples": [
              -20.529646135409877,
              -14.996689026760535,
              -19.622937710788648,
              -20.377419727086505,
              -15.848550644887837,
              -17.045472399103772,
              -21.317046602623932,
              -12.290208378966184,
              -21.17905960337704,
              -17.851525698047027
            ],
            "student_t_critical": 2.262
          },
          "baseline": {
            "count": 10,
            "max": 124.88812183953715,
            "mean": 122.92370949460397,
            "min": 118.58330808003132,
            "p50": 123.50693133508986,
            "p95": 124.88812183953715,
            "p99": 124.88812183953715
          },
          "candidate": {
            "count": 10,
            "max": 107.65838069020202,
            "mean": 104.81785390189881,
            "min": 103.23755286869576,
            "p50": 103.85518660585831,
            "p95": 107.65838069020202,
            "p99": 107.65838069020202
          },
          "relative_improvement": {
            "ci95_high": -0.130733392732696,
            "ci95_low": -0.16324752225758296,
            "mean": -0.14699045749513948,
            "n": 10,
            "samples": [
              -0.16504943314200868,
              -0.12461585651706253,
              -0.159479568754873,
              -0.16328652464087573,
              -0.12832114338497103,
              -0.14120549508373695,
              -0.17113749369736084,
              -0.10364197607534764,
              -0.17022694303086738,
              -0.142940140624291
            ],
            "student_t_critical": 2.262
          }
        },
        "major_faults": {
          "absolute_candidate_minus_baseline": {
            "ci95_high": 0.0,
            "ci95_low": 0.0,
            "mean": 0.0,
            "n": 10,
            "samples": [
              0.0,
              0.0,
              0.0,
              0.0,
              0.0,
              0.0,
              0.0,
              0.0,
              0.0,
              0.0
            ],
            "student_t_critical": 2.262
          },
          "baseline": {
            "count": 10,
            "max": 0.0,
            "mean": 0.0,
            "min": 0.0,
            "p50": 0.0,
            "p95": 0.0,
            "p99": 0.0
          },
          "candidate": {
            "count": 10,
            "max": 0.0,
            "mean": 0.0,
            "min": 0.0,
            "p50": 0.0,
            "p95": 0.0,
            "p99": 0.0
          },
          "relative_improvement": {
            "ci95_high": 0.0,
            "ci95_low": 0.0,
            "mean": 0.0,